"36035","24603","Fulton NY","Ephratah town, Fulton NY",1677,1,0.0314 
"36035","29443","Fulton NY","Gloversville city, Fulton NY",15131,1,0.2838 
"36035","38781","Fulton NY","Johnstown city, Fulton NY",8204,1,0.1539 
"36035","38792","Fulton NY","Johnstown town, Fulton NY",6867,1,0.1288 
"36035","46217","Fulton NY","Mayfield town, Fulton NY",6146,1,0.1153 
"36035","51407","Fulton NY","Northampton town, Fulton NY",2472,1,0.0464 
"36035","55101","Fulton NY","Oppenheim town, Fulton NY",1751,1,0.0328 
"36035","57353","Fulton NY","Perth town, Fulton NY",3584,1,0.0672 
"36035","71784","Fulton NY","Stratford town, Fulton NY",538,1,0.0101 
"36037","00474","Genesee NY","Alabama town, Genesee NY",1602,1,0.0274 
"36037","01165","Genesee NY","Alexander town, Genesee NY",2491,1,0.0427 
"36037","04715","Genesee NY","Batavia city, Genesee NY",15600,1,0.2672 
"36037","04726","Genesee NY","Batavia town, Genesee NY",6293,1,0.1078 
"36037","06057","Genesee NY","Bergen town, Genesee NY",3120,1,0.0534 
"36037","06266","Genesee NY","Bethany town, Genesee NY",1780,1,0.0305 
"36037","11572","Genesee NY","Byron town, Genesee NY",2302,1,0.0394 
"36037","19719","Genesee NY","Darien town, Genesee NY",3010,1,0.0516 
"36037","23756","Genesee NY","Elba town, Genesee NY",2164,1,0.0371 
"36037","42037","Genesee NY","Le Roy town, Genesee NY",7662,1,0.1312 
"36037","54166","Genesee NY","Oakfield town, Genesee NY",3145,1,0.0539 
"36037","56792","Genesee NY","Pavilion town, Genesee NY",2290,1,0.0392 
"36037","57078","Genesee NY","Pembroke town, Genesee NY",4264,1,0.073 
"36037","70607","Genesee NY","Stafford town, Genesee NY",2424,1,0.0415 
"36037","75011","Genesee NY","Tonawanda Reservation, Genesee NY",241,1,0.0041 
"36039","02803","Greene NY","Ashland town, Greene NY",682,1,0.0142 
"36039","02913","Greene NY","Athens town, Greene NY",3916,1,0.0817 
"36039","11649","Greene NY","Cairo town, Greene NY",6644,1,0.1386 
"36039","13013","Greene NY","Catskill town, Greene NY",11298,1,0.2357 
"36039","18729","Greene NY","Coxsackie town, Greene NY",8382,1,0.1749 
"36039","21204","Greene NY","Durham town, Greene NY",2627,1,0.0548 
"36039","30620","Greene NY","Greenville town, Greene NY",3741,1,0.078 
"36039","31379","Greene NY","Halcott town, Greene NY",249,1,0.0052 
"36039","36178","Greene NY","Hunter town, Greene NY",3035,1,0.0633 
"36039","38638","Greene NY","Jewett town, Greene NY",879,1,0.0183 
"36039","42202","Greene NY","Lexington town, Greene NY",770,1,0.0161 
"36039","49935","Greene NY","New Baltimore town, Greene NY",3226,1,0.0673 
"36039","59751","Greene NY","Prattsville town, Greene NY",774,1,0.0161 
"36039","82480","Greene NY","Windham town, Greene NY",1708,1,0.0356 
"36041","02572","Hamilton NY","Arietta town, Hamilton NY",292,1,0.0572 
"36041","05958","Hamilton NY","Benson town, Hamilton NY",221,1,0.0433 
"36041","35496","Hamilton NY","Hope town, Hamilton NY",413,1,0.0809 
"36041","37374","Hamilton NY","Indian Lake town, Hamilton NY",1363,1,0.2669 
"36041","37495","Hamilton NY","Inlet town, Hamilton NY",355,1,0.0695 
"36041","40794","Hamilton NY","Lake Pleasant town, Hamilton NY",897,1,0.1756 
"36041","43412","Hamilton NY","Long Lake town, Hamilton NY",791,1,0.1549 
"36041","48340","Hamilton NY","Morehouse town, Hamilton NY",92,1,0.018 
"36041","79059","Hamilton NY","Wells town, Hamilton NY",683,1,0.1337 
"36043","17431","Herkimer NY","Columbia town, Herkimer NY",1569,1,0.0261 
"36043","19686","Herkimer NY","Danube town, Herkimer NY",953,1,0.0158 
"36043","24933","Herkimer NY","Fairfield town, Herkimer NY",1475,1,0.0245 
"36043","27199","Herkimer NY","Frankfort town, Herkimer NY",7011,1,0.1166 
"36043","28750","Herkimer NY","German Flatts town, Herkimer NY",12263,1,0.2039 
"36043","34132","Herkimer NY","Herkimer town, Herkimer NY",9566,1,0.1591 
"36043","42664","Herkimer NY","Litchfield town, Herkimer NY",1444,1,0.024 
"36043","42741","Herkimer NY","Little Falls city, Herkimer NY",4605,1,0.0766 
"36043","42752","Herkimer NY","Little Falls town, Herkimer NY",1497,1,0.0249 
"36043","44974","Herkimer NY","Manheim town, Herkimer NY",3082,1,0.0512 
"36043","50584","Herkimer NY","Newport town, Herkimer NY",2140,1,0.0356 
"36043","53968","Herkimer NY","Norway town, Herkimer NY",740,1,0.0123 
"36043","54507","Herkimer NY","Ohio town, Herkimer NY",962,1,0.016 
"36043","64254","Herkimer NY","Russia town, Herkimer NY",2269,1,0.0377 
"36043","64837","Herkimer NY","Salisbury town, Herkimer NY",1830,1,0.0304 
"36043","65695","Herkimer NY","Schuyler town, Herkimer NY",3296,1,0.0548 
"36043","70794","Herkimer NY","Stark town, Herkimer NY",714,1,0.0119 
"36043","78278","Herkimer NY","Warren town, Herkimer NY",1029,1,0.0171 
"36043","78927","Herkimer NY","Webb town, Herkimer NY",1797,1,0.0299 
"36043","82568","Herkimer NY","Winfield town, Herkimer NY",1897,1,0.0315 
"36045","00000","Jefferson NY","[undefined MCD], Jefferson NY",0,,0 
"36045","00210","Jefferson NY","Adams town, Jefferson NY",4973,1,0.0426 
"36045","01176","Jefferson NY","Alexandria town, Jefferson NY",3741,1,0.0321 
"36045","02297","Jefferson NY","Antwerp town, Jefferson NY",1683,1,0.0144 
"36045","10242","Jefferson NY","Brownville town, Jefferson NY",5842,1,0.0501 
"36045","12364","Jefferson NY","Cape Vincent town, Jefferson NY",2765,1,0.0237 
"36045","13717","Jefferson NY","Champion town, Jefferson NY",4562,1,0.0391 
"36045","16100","Jefferson NY","Clayton town, Jefferson NY",4770,1,0.0409 
"36045","20214","Jefferson NY","3604520214",0,,0 
"36045","20555","Jefferson NY","3604520555",0,,0 
"36045","24086","Jefferson NY","Ellisburg town, Jefferson NY",3352,1,0.0287 
"36045","34055","Jefferson NY","Henderson town, Jefferson NY",1438,1,0.0123 
"36045","35782","Jefferson NY","Hounsfield town, Jefferson NY",3281,1,0.0281 
"36045","42015","Jefferson NY","Le Ray town, Jefferson NY",25574,1,0.2191 
"36045","43544","Jefferson NY","Lorraine town, Jefferson NY",924,1,0.0079 
"36045","43863","Jefferson NY","Lyme town, Jefferson NY",2299,1,0.0197 
"36045","55398","Jefferson NY","Orleans town, Jefferson NY",2788,1,0.0239 
"36045","56209","Jefferson NY","Pamelia town, Jefferson NY",3343,1,0.0286 
"36045","57562","Jefferson NY","Philadelphia town, Jefferson NY",1975,1,0.0169 
"36045","63341","Jefferson NY","Rodman town, Jefferson NY",1197,1,0.0103 
"36045","64265","Jefferson NY","Rutland town, Jefferson NY",3038,1,0.026 
"36045","73528","Jefferson NY","Theresa town, Jefferson NY",2648,1,0.0227 
"36045","78608","Jefferson NY","Watertown city, Jefferson NY",24685,1,0.2115 
"36045","78619","Jefferson NY","Watertown town, Jefferson NY",5913,1,0.0507 
"36045","82348","Jefferson NY","Wilna town, Jefferson NY",5732,1,0.0491 
"36045","83162","Jefferson NY","Worth town, Jefferson NY",198,1,0.0017 
"36047","10022","Kings NY","Brooklyn borough, Kings NY",2736074,1,1 
"36049","19081","Lewis NY","Croghan town, Lewis NY",3197,1,0.1203 
"36049","20214","Lewis NY","Denmark town, Lewis NY",2626,1,0.0988 
"36049","20555","Lewis NY","Diana town, Lewis NY",1610,1,0.0606 
"36049","30796","Lewis NY","Greig town, Lewis NY",1179,1,0.0444 
"36049","32358","Lewis NY","Harrisburg town, Lewis NY",480,1,0.0181 
"36049","42125","Lewis NY","Lewis town, Lewis NY",844,1,0.0318 
"36049","42213","Lewis NY","Leyden town, Lewis NY",1572,1,0.0591 
"36049","43731","Lewis NY","Lowville town, Lewis NY",4888,1,0.1839 
"36049","43995","Lewis NY","Lyonsdale town, Lewis NY",1170,1,0.044 
"36049","45854","Lewis NY","Martinsburg town, Lewis NY",1316,1,0.0495 
"36049","48032","Lewis NY","Montague town, Lewis NY",97,1,0.0036 
"36049","50001","Lewis NY","New Bremen town, Lewis NY",2785,1,0.1048 
"36049","55497","Lewis NY","Osceola town, Lewis NY",243,1,0.0091 
"36049","57925","Lewis NY","Pinckney town, Lewis NY",313,1,0.0118 
"36049","75693","Lewis NY","Turin town, Lewis NY",768,1,0.0289 
"36049","78729","Lewis NY","Watson town, Lewis NY",1802,1,0.0678 
"36049","81094","Lewis NY","West Turin town, Lewis NY",1692,1,0.0637 
"36051","03364","Livingston NY","Avon town, Livingston NY",6939,1,0.1122 
"36051","11715","Livingston NY","Caledonia town, Livingston NY",4154,1,0.0672 
"36051","17618","Livingston NY","Conesus town, Livingston NY",2320,1,0.0375 
"36051","28629","Livingston NY","Geneseo town, Livingston NY",10234,1,0.1655 
"36051","31016","Livingston NY","Groveland town, Livingston NY",2316,1,0.0375 
"36051","41883","Livingston NY","Leicester town, Livingston NY",2082,1,0.0337 
"36051","42334","Livingston NY","Lima town, Livingston NY",4154,1,0.0672 
"36051","42961","Livingston NY","Livonia town, Livingston NY",7497,1,0.1212 
"36051","48956","Livingston NY","Mount Morris town, Livingston NY",4435,1,0.0717 
"36051","51869","Livingston NY","North Dansville town, Livingston NY",5321,1,0.0861 
"36051","54089","Livingston NY","Nunda town, Livingston NY",2688,1,0.0435 
"36051","55508","Livingston NY","Ossian town, Livingston NY",724,1,0.0117 
"36051","59179","Livingston NY","Portage town, Livingston NY",763,1,0.0123 
"36051","70101","Livingston NY","Sparta town, Livingston NY",1583,1,0.0256 
"36051","70475","Livingston NY","Springwater town, Livingston NY",2286,1,0.037 
"36051","81006","Livingston NY","West Sparta town, Livingston NY",1156,1,0.0187 
"36051","84022","Livingston NY","York town, Livingston NY",3182,1,0.0515 
"36053","08587","Madison NY","Brookfield town, Madison NY",2247,1,0.033 
"36053","13156","Madison NY","Cazenovia town, Madison NY",6740,1,0.0991 
"36053","20401","Madison NY","DeRuyter town, Madison NY",1276,1,0.0188 
"36053","23305","Madison NY","Eaton town, Madison NY",4284,1,0.063 
"36053","25593","Madison NY","Fenner town, Madison NY",1668,1,0.0245 
"36053","28695","Madison NY","Georgetown town, Madison NY",648,1,0.0095 
"36053","31720","Madison NY","Hamilton town, Madison NY",6379,1,0.0938 
"36053","41674","Madison NY","Lebanon town, Madison NY",1326,1,0.0195 
"36053","41905","Madison NY","Lenox town, Madison NY",8768,1,0.1289 
"36053","42422","Madison NY","Lincoln town, Madison NY",1802,1,0.0265 
"36053","44435","Madison NY","Madison town, Madison NY",2766,1,0.0407 
"36053","49770","Madison NY","Nelson town, Madison NY",1890,1,0.0278 
"36053","54837","Madison NY","Oneida city, Madison NY",10329,1,0.1519 
"36053","67785","Madison NY","Smithfield town, Madison NY",1127,1,0.0166 
"36053","71399","Madison NY","Stockbridge town, Madison NY",1972,1,0.029 
"36053","71993","Madison NY","Sullivan town, Madison NY",14794,1,0.2175 
"36055","00000","Monroe NY","[undefined MCD], Monroe NY",0,,0 
"36055","08246","Monroe NY","Brighton town, Monroe NY",37137,1,0.0489 
"36055","15462","Monroe NY","Chili town, Monroe NY",29123,1,0.0383 
"36055","15957","Monroe NY","Clarkson town, Monroe NY",6904,1,0.0091 
"36055","22870","Monroe NY","East Rochester town, Monroe NY",6334,1,0.0083 
"36055","28442","Monroe NY","Gates town, Monroe NY",29167,1,0.0384 
"36055","30290","Monroe NY","Greece town, Monroe NY",96926,1,0.1276 
"36055","31797","Monroe NY","Hamlin town, Monroe NY",8725,1,0.0115 
"36055","34099","Monroe NY","Henrietta town, Monroe NY",47096,1,0.062 
"36055","37726","Monroe NY","Irondequoit town, Monroe NY",51043,1,0.0672 
"36055","46558","Monroe NY","Mendon town, Monroe NY",9095,1,0.012 
"36055","54474","Monroe NY","Ogden town, Monroe NY",20270,1,0.0267 
"36055","56561","Monroe NY","Parma town, Monroe NY",16217,1,0.0214 
"36055","57144","Monroe NY","Penfield town, Monroe NY",39438,1,0.0519 
"36055","57221","Monroe NY","Perinton town, Monroe NY",47479,1,0.0625 
"36055","58365","Monroe NY","Pittsford town, Monroe NY",30617,1,0.0403 
"36055","61808","Monroe NY","Riga town, Monroe NY",5586,1,0.0074 
"36055","63000","Monroe NY","Rochester city, Monroe NY",211328,1,0.2783 
"36055","64144","Monroe NY","Rush town, Monroe NY",3490,1,0.0046 
"36055","72455","Monroe NY","Sweden town, Monroe NY",13244,1,0.0174 
"36055","78971","Monroe NY","Webster town, Monroe NY",45327,1,0.0597 
"36055","81402","Monroe NY","Wheatland town, Monroe NY",4897,1,0.0064 
"36057","02066","Montgomery NY","Amsterdam city, Montgomery NY",18219,1,0.3678 
"36057","02077","Montgomery NY","Amsterdam town, Montgomery NY",5557,1,0.1122 
"36057","12122","Montgomery NY","Canajoharie town, Montgomery NY",3660,1,0.0739 
"36057","13816","Montgomery NY","Charleston town, Montgomery NY",1355,1,0.0274 
"36057","26308","Montgomery NY","Florida town, Montgomery NY",2667,1,0.0538 
"36057","29047","Montgomery NY","Glen town, Montgomery NY",2536,1,0.0512 
"36057","47614","Montgomery NY","Minden town, Montgomery NY",4166,1,0.0841 
"36057","47834","Montgomery NY","Mohawk town, Montgomery NY",3572,1,0.0721 
"36057","56099","Montgomery NY","Palatine town, Montgomery NY",3189,1,0.0644 
"36057","63561","Montgomery NY","Root town, Montgomery NY",2013,1,0.0406 
"36057","64650","Montgomery NY","St. Johnsville town, Montgomery NY",2598,1,0.0525 
"36059","29113","Nassau NY","Glen Cove city, Nassau NY",28365,1,0.0203 
"36059","34000","Nassau NY","Hempstead town, Nassau NY",793409,1,0.5684 
"36059","43335","Nassau NY","Long Beach city, Nassau NY",35029,1,0.0251 
"36059","53000","Nassau NY","North Hempstead town, Nassau NY",237639,1,0.1703 
"36059","56000","Nassau NY","Oyster Bay town, Nassau NY",301332,1,0.2159 
"36061","44919","New York NY","Manhattan borough, New York NY",1694251,1,1 
"36063","00000","Niagara NY","[undefined MCD], Niagara NY",0,,0 
"36063","11803","Niagara NY","Cambria town, Niagara NY",5743,1,0.027 
"36063","32490","Niagara NY","Hartland town, Niagara NY",3874,1,0.0182 
"36063","42158","Niagara NY","Lewiston town, Niagara NY",15944,1,0.075 
"36063","43082","Niagara NY","Lockport city, Niagara NY",20876,1,0.0982 
"36063","43093","Niagara NY","Lockport town, Niagara NY",20563,1,0.0967 
"36063","50232","Niagara NY","Newfane town, Niagara NY",9304,1,0.0437 
"36063","51033","Niagara NY","Niagara town, Niagara NY",7903,1,0.0372 
"36063","51055","Niagara NY","Niagara Falls city, Niagara NY",48671,1,0.2289 
"36063","53682","Niagara NY","North Tonawanda city, Niagara NY",30496,1,0.1434 
"36063","57111","Niagara NY","Pendleton town, Niagara NY",7035,1,0.0331 
"36063","59267","Niagara NY","Porter town, Niagara NY",6513,1,0.0306 
"36063","64034","Niagara NY","Royalton town, Niagara NY",7517,1,0.0353 
"36063","68330","Niagara NY","Somerset town, Niagara NY",2597,1,0.0122 
"36063","75011","Niagara NY","Tonawanda Reservation, Niagara NY",0,,0 
"36063","75748","Niagara NY","Tuscarora Nation Reservation, Niagara NY",1145,1,0.0054 
"36063","81380","Niagara NY","Wheatfield town, Niagara NY",18638,1,0.0876 
"36063","82370","Niagara NY","Wilson town, Niagara NY",5847,1,0.0275 
"36065","02253","Oneida NY","Annsville town, Oneida NY",2639,1,0.0114 
"36065","03155","Oneida NY","Augusta town, Oneida NY",2021,1,0.0087 
"36065","03309","Oneida NY","Ava town, Oneida NY",680,1,0.0029 
"36065","07366","Oneida NY","Boonville town, Oneida NY",4518,1,0.0195 
"36065","08180","Oneida NY","Bridgewater town, Oneida NY",1507,1,0.0065 
"36065","11858","Oneida NY","Camden town, Oneida NY",4787,1,0.0206 
"36065","19928","Oneida NY","Deerfield town, Oneida NY",3983,1,0.0172 
"36065","26297","Oneida NY","Florence town, Oneida NY",1284,1,0.0055 
"36065","26385","Oneida NY","Floyd town, Oneida NY",3733,1,0.0161 
"36065","26627","Oneida NY","Forestport town, Oneida NY",1477,1,0.0064 
"36065","39804","Oneida NY","Kirkland town, Oneida NY",10075,1,0.0434 
"36065","41762","Oneida NY","Lee town, Oneida NY",6171,1,0.0266 
"36065","45535","Oneida NY","Marcy town, Oneida NY",8777,1,0.0378 
"36065","45755","Oneida NY","Marshall town, Oneida NY",1966,1,0.0085 
"36065","50309","Oneida NY","New Hartford town, Oneida NY",21874,1,0.0942 
"36065","56330","Oneida NY","Paris town, Oneida NY",4332,1,0.0187 
"36065","61126","Oneida NY","Remsen town, Oneida NY",1761,1,0.0076 
"36065","63418","Oneida NY","Rome city, Oneida NY",32127,1,0.1384 
"36065","65134","Oneida NY","Sangerfield town, Oneida NY",2327,1,0.01 
"36065","71212","Oneida NY","Steuben town, Oneida NY",1081,1,0.0047 
"36065","75280","Oneida NY","Trenton town, Oneida NY",4297,1,0.0185 
"36065","76540","Oneida NY","Utica city, Oneida NY",65283,1,0.2812 
"36065","77123","Oneida NY","Vernon town, Oneida NY",8318,1,0.0358 
"36065","77178","Oneida NY","Verona town, Oneida NY",5974,1,0.0257 
"36065","77486","Oneida NY","Vienna town, Oneida NY",5260,1,0.0227 
"36065","79862","Oneida NY","Western town, Oneida NY",1831,1,0.0079 
"36065","80533","Oneida NY","Westmoreland town, Oneida NY",5924,1,0.0255 
"36065","81754","Oneida NY","Whitestown town, Oneida NY",18118,1,0.0781 
"36067","11913","Onondaga NY","Camillus town, Onondaga NY",25346,1,0.0532 
"36067","15704","Onondaga NY","Cicero town, Onondaga NY",31435,1,0.066 
"36067","16067","Onondaga NY","Clay town, Onondaga NY",60527,1,0.127 
"36067","20478","Onondaga NY","De Witt town, Onondaga NY",26074,1,0.0547 
"36067","23800","Onondaga NY","Elbridge town, Onondaga NY",5476,1,0.0115 
"36067","24878","Onondaga NY","Fabius town, Onondaga NY",2006,1,0.0042 
"36067","28519","Onondaga NY","Geddes town, Onondaga NY",17088,1,0.0359 
"36067","40266","Onondaga NY","LaFayette town, Onondaga NY",4910,1,0.0103 
"36067","44039","Onondaga NY","Lysander town, Onondaga NY",23074,1,0.0484 
"36067","45029","Onondaga NY","Manlius town, Onondaga NY",33712,1,0.0707 
"36067","45491","Onondaga NY","Marcellus town, Onondaga NY",6066,1,0.0127 
"36067","54958","Onondaga NY","Onondaga town, Onondaga NY",22937,1,0.0481 
"36067","54980","Onondaga NY","Onondaga Nation Reservation, Onondaga NY",831,1,0.0017 
"36067","55651","Onondaga NY","Otisco town, Onondaga NY",2368,1,0.005 
"36067","59036","Onondaga NY","Pompey town, Onondaga NY",7080,1,0.0149 
"36067","64815","Onondaga NY","Salina town, Onondaga NY",33223,1,0.0697 
"36067","67521","Onondaga NY","Skaneateles town, Onondaga NY",7112,1,0.0149 
"36067","70057","Onondaga NY","Spafford town, Onondaga NY",1588,1,0.0033 
"36067","73000","Onondaga NY","Syracuse city, Onondaga NY",148620,1,0.3119 
"36067","75638","Onondaga NY","Tully town, Onondaga NY",2676,1,0.0056 
"36067","76760","Onondaga NY","Van Buren town, Onondaga NY",14367,1,0.0302 
"36069","08378","Ontario NY","Bristol town, Ontario NY",2284,1,0.0203 
"36069","12100","Ontario NY","Canadice town, Ontario NY",1668,1,0.0148 
"36069","12144","Ontario NY","Canandaigua city, Ontario NY",10576,1,0.094 
"36069","12155","Ontario NY","Canandaigua town, Ontario NY",11109,1,0.0988 
"36069","21699","Ontario NY","East Bloomfield town, Ontario NY",3640,1,0.0324 
"36069","25406","Ontario NY","Farmington town, Ontario NY",14170,1,0.126 
"36069","28640","Ontario NY","Geneva city, Ontario NY",12812,1,0.1139 
"36069","28651","Ontario NY","Geneva town, Ontario NY",3473,1,0.0309 
"36069","29531","Ontario NY","Gorham town, Ontario NY",4106,1,0.0365 
"36069","35551","Ontario NY","Hopewell town, Ontario NY",3931,1,0.035 
"36069","44864","Ontario NY","Manchester town, Ontario NY",9404,1,0.0836 
"36069","49440","Ontario NY","Naples town, Ontario NY",2403,1,0.0214 
"36069","57529","Ontario NY","Phelps town, Ontario NY",6637,1,0.059 
"36069","61544","Ontario NY","Richmond town, Ontario NY",3360,1,0.0299 
"36069","66289","Ontario NY","Seneca town, Ontario NY",2644,1,0.0235 
"36069","68660","Ontario NY","South Bristol town, Ontario NY",1641,1,0.0146 
"36069","77387","Ontario NY","Victor town, Ontario NY",15860,1,0.141 
"36069","79356","Ontario NY","West Bloomfield town, Ontario NY",2740,1,0.0244 
"36071","07003","Orange NY","Blooming Grove town, Orange NY",18811,1,0.0469 
"36071","15308","Orange NY","Chester town, Orange NY",12646,1,0.0315 
"36071","18300","Orange NY","Cornwall town, Orange NY",12884,1,0.0321 
"36071","18916","Orange NY","Crawford town, Orange NY",9130,1,0.0228 
"36071","19961","Orange NY","Deerpark town, Orange NY",7509,1,0.0187 
"36071","29553","Orange NY","Goshen town, Orange NY",14571,1,0.0363 
"36071","30631","Orange NY","Greenville town, Orange NY",4689,1,0.0117 
"36071","31907","Orange NY","Hamptonburgh town, Orange NY",5489,1,0.0137 
"36071","34550","Orange NY","Highlands town, Orange NY",12939,1,0.0322 
"36071","47042","Orange NY","Middletown city, Orange NY",30345,1,0.0756 
"36071","47713","Orange NY","Minisink town, Orange NY",4621,1,0.0115 
"36071","47999","Orange NY","Monroe town, Orange NY",21387,1,0.0533 
"36071","48153","Orange NY","Montgomery town, Orange NY",23322,1,0.0581 
"36071","48857","Orange NY","Mount Hope town, Orange NY",6537,1,0.0163 
"36071","50034","Orange NY","Newburgh city, Orange NY",28856,1,0.0719 
"36071","50045","Orange NY","Newburgh town, Orange NY",31985,1,0.0797 
"36071","50848","Orange NY","New Windsor town, Orange NY",27805,1,0.0693 
"36071","56185","Orange NY","Palm Tree town, Orange NY",32954,1,0.0821 
"36071","59388","Orange NY","Port Jervis city, Orange NY",8775,1,0.0219 
"36071","75781","Orange NY","Tuxedo town, Orange NY",3811,1,0.0095 
"36071","77992","Orange NY","Wallkill town, Orange NY",30486,1,0.076 
"36071","78366","Orange NY","Warwick town, Orange NY",32027,1,0.0798 
"36071","78839","Orange NY","Wawayanda town, Orange NY",7534,1,0.0188 
"36071","82755","Orange NY","Woodbury town, Orange NY",12197,1,0.0304 
"36073","00000","Orleans NY","[undefined MCD], Orleans NY",0,,0 
"36073","01044","Orleans NY","Albion town, Orleans NY",7639,1,0.1894 
"36073","04572","Orleans NY","Barre town, Orleans NY",1843,1,0.0457 
"36073","12496","Orleans NY","Carlton town, Orleans NY",2835,1,0.0703 
"36073","15880","Orleans NY","Clarendon town, Orleans NY",3315,1,0.0822 
"36073","27958","Orleans NY","Gaines town, Orleans NY",3226,1,0.08 
"36073","39188","Orleans NY","Kendall town, Orleans NY",2617,1,0.0649 
"36073","49286","Orleans NY","Murray town, Orleans NY",4796,1,0.1189 
"36073","61742","Orleans NY","Ridgeway town, Orleans NY",6598,1,0.1635 
"36073","66751","Orleans NY","Shelby town, Orleans NY",4907,1,0.1216 
"36073","83448","Orleans NY","Yates town, Orleans NY",2567,1,0.0636 
"36075","00000","Oswego NY","[undefined MCD], Oswego NY",0,,0 
"36075","01055","Oswego NY","Albion town, Oswego NY",2009,1,0.0171 
"36075","01649","Oswego NY","Amboy town, Oswego NY",1245,1,0.0106 
"36075","07674","Oswego NY","Boylston town, Oswego NY",498,1,0.0042 
"36075","17904","Oswego NY","Constantia town, Oswego NY",4778,1,0.0407 
"36075","27815","Oswego NY","Fulton city, Oswego NY",11389,1,0.0969 
"36075","29729","Oswego NY","Granby town, Oswego NY",6520,1,0.0555 
"36075","32028","Oswego NY","Hannibal town, Oswego NY",4525,1,0.0385 
"36075","32688","Oswego NY","Hastings town, Oswego NY",9342,1,0.0795 
"36075","46822","Oswego NY","Mexico town, Oswego NY",5259,1,0.0447 
"36075","47691","Oswego NY","Minetto town, Oswego NY",1643,1,0.014 
"36075","50342","Oswego NY","New Haven town, Oswego NY",2931,1,0.0249 
"36075","55453","Oswego NY","Orwell town, Oswego NY",1077,1,0.0092 
"36075","55574","Oswego NY","Oswego city, Oswego NY",16921,1,0.144 
"36075","55585","Oswego NY","Oswego town, Oswego NY",7914,1,0.0673 
"36075","56154","Oswego NY","Palermo town, Oswego NY",3470,1,0.0295 
"36075","56352","Oswego NY","Parish town, Oswego NY",2398,1,0.0204 
"36075","60873","Oswego NY","Redfield town, Oswego NY",476,1,0.0041 
"36075","61533","Oswego NY","Richland town, Oswego NY",5637,1,0.048 
"36075","65079","Oswego NY","Sandy Creek town, Oswego NY",3813,1,0.0324 
"36075","65618","Oswego NY","Schroeppel town, Oswego NY",7969,1,0.0678 
"36075","65992","Oswego NY","Scriba town, Oswego NY",6617,1,0.0563 
"36075","77662","Oswego NY","Volney town, Oswego NY",5671,1,0.0483 
"36075","80500","Oswego NY","West Monroe town, Oswego NY",4088,1,0.0348 
"36075","82073","Oswego NY","Williamstown town, Oswego NY",1335,1,0.0114 
"36077","11209","Otsego NY","Burlington town, Otsego NY",1045,1,0.0179 
"36077","11528","Otsego NY","Butternuts town, Otsego NY",1665,1,0.0284 
"36077","15253","Otsego NY","Cherry Valley town, Otsego NY",1229,1,0.021 
"36077","19895","Otsego NY","Decatur town, Otsego NY",374,1,0.0064 
"36077","23613","Otsego NY","Edmeston town, Otsego NY",1907,1,0.0326 
"36077","24845","Otsego NY","Exeter town, Otsego NY",845,1,0.0144 
"36077","32589","Otsego NY","Hartwick town, Otsego NY",1952,1,0.0334 
"36077","41531","Otsego NY","Laurens town, Otsego NY",2311,1,0.0395 
"36077","45920","Otsego NY","Maryland town, Otsego NY",1760,1,0.0301 
"36077","46910","Otsego NY","Middlefield town, Otsego NY",1882,1,0.0322 
"36077","47240","Otsego NY","Milford town, Otsego NY",2827,1,0.0483 
"36077","48494","Otsego NY","Morris town, Otsego NY",1735,1,0.0296 
"36077","50485","Otsego NY","New Lisbon town, Otsego NY",1084,1,0.0185 
"36077","54881","Otsego NY","Oneonta city, Otsego NY",13079,1,0.2235 
"36077","54892","Otsego NY","Oneonta town, Otsego NY",5065,1,0.0865 
"36077","55629","Otsego NY","Otego town, Otsego NY",2756,1,0.0471 
"36077","55695","Otsego NY","Otsego town, Otsego NY",3641,1,0.0622 
"36077","58343","Otsego NY","Pittsfield town, Otsego NY",1312,1,0.0224 
"36077","58420","Otsego NY","Plainfield town, Otsego NY",922,1,0.0158 
"36077","61467","Otsego NY","Richfield town, Otsego NY",2065,1,0.0353 
"36077","63638","Otsego NY","Roseboom town, Otsego NY",690,1,0.0118 
"36077","70310","Otsego NY","Springfield town, Otsego NY",1346,1,0.023 
"36077","76012","Otsego NY","Unadilla town, Otsego NY",4116,1,0.0703 
"36077","79972","Otsego NY","Westford town, Otsego NY",804,1,0.0137 
"36077","83129","Otsego NY","Worcester town, Otsego NY",2112,1,0.0361 
"36079","12529","Putnam NY","Carmel town, Putnam NY",33576,1,0.3438 
"36079","39331","Putnam NY","Kent town, Putnam NY",12900,1,0.1321 
"36079","56748","Putnam NY","Patterson town, Putnam NY",11541,1,0.1182 
"36079","57584","Putnam NY","Philipstown town, Putnam NY",9831,1,0.1007 
"36079","60147","Putnam NY","Putnam Valley town, Putnam NY",11762,1,0.1204 
"36079","68924","Putnam NY","Southeast town, Putnam NY",18058,1,0.1849 
"36081","60323","Queens NY","Queens borough, Queens NY",2405464,1,1 
"36083","06189","Rensselaer NY","Berlin town, Rensselaer NY",1808,1,0.0112 
"36083","10275","Rensselaer NY","Brunswick town, Rensselaer NY",12581,1,0.0781 
